{"$defs":{"ContractChangeRequest":{"additionalProperties":false,"properties":{"affected_specs":{"items":{"enum":["S00","S01","S02","S03","S04","S05","S06","S07","S08"],"type":"string"},"title":"Affected Specs","type":"array"},"affected_types_or_codes":{"items":{"maxLength":65536,"minLength":1,"type":"string"},"title":"Affected Types Or Codes","type":"array"},"compatibility":{"maxLength":65536,"minLength":1,"title":"Compatibility","type":"string"},"current_contract_revision":{"maxLength":65536,"minLength":1,"title":"Current Contract Revision","type":"string"},"fixture_and_test_changes":{"items":{"maxLength":65536,"minLength":1,"type":"string"},"title":"Fixture And Test Changes","type":"array"},"problem":{"maxLength":65536,"minLength":1,"title":"Problem","type":"string"},"proposed_change":{"maxLength":65536,"minLength":1,"title":"Proposed Change","type":"string"},"request_id":{"maxLength":65536,"minLength":1,"title":"Request Id","type":"string"},"requesting_spec":{"enum":["S00","S01","S02","S03","S04","S05","S06","S07","S08"],"title":"Requesting Spec","type":"string"}},"required":["request_id","requesting_spec","current_contract_revision","problem","proposed_change","affected_types_or_codes","affected_specs","compatibility","fixture_and_test_changes"],"title":"ContractChangeRequest","type":"object"},"DependencyRequest":{"additionalProperties":false,"properties":{"license_impact":{"maxLength":65536,"minLength":1,"title":"License Impact","type":"string"},"package":{"maxLength":65536,"minLength":1,"title":"Package","type":"string"},"purpose":{"maxLength":65536,"minLength":1,"title":"Purpose","type":"string"},"version":{"maxLength":65536,"minLength":1,"title":"Version","type":"string"}},"required":["package","version","purpose","license_impact"],"title":"DependencyRequest","type":"object"},"ExecutorSpec":{"additionalProperties":false,"properties":{"model":{"const":"gpt-5.6-sol","title":"Model","type":"string"},"reasoning_effort":{"const":"ultra","title":"Reasoning Effort","type":"string"}},"required":["model","reasoning_effort"],"title":"ExecutorSpec","type":"object"},"HandoffTestResult":{"additionalProperties":false,"properties":{"command":{"maxLength":65536,"minLength":1,"title":"Command","type":"string"},"status":{"enum":["passed","failed","skipped"],"title":"Status","type":"string"},"summary":{"anyOf":[{"maxLength":65536,"minLength":1,"type":"string"},{"type":"null"}],"default":null,"title":"Summary"}},"required":["command","status"],"title":"HandoffTestResult","type":"object"}},"$schema":"https://json-schema.org/draft/2020-12/schema","additionalProperties":false,"properties":{"branch":{"pattern":"^codex/.+","title":"Branch","type":"string"},"changed_files":{"items":{"minLength":1,"pattern":"^(?!/)(?![A-Za-z]:)(?!.*\\\\)(?!.*(?:^|/)(?:\\.{1,2})(?:/|$))(?!.*//).+$","type":"string"},"title":"Changed Files","type":"array"},"contract_base_commit":{"pattern":"^[0-9a-f]{40,64}$","title":"Contract Base Commit","type":"string"},"contract_change_requests":{"items":{"$ref":"#/$defs/ContractChangeRequest"},"title":"Contract Change Requests","type":"array"},"contract_revision":{"const":"v1-contract-r1","title":"Contract Revision","type":"string"},"dependency_requests":{"items":{"$ref":"#/$defs/DependencyRequest"},"title":"Dependency Requests","type":"array"},"executor":{"$ref":"#/$defs/ExecutorSpec"},"fixtures_consumed":{"items":{"minLength":1,"pattern":"^(?!/)(?![A-Za-z]:)(?!.*\\\\)(?!.*(?:^|/)(?:\\.{1,2})(?:/|$))(?!.*//).+$","type":"string"},"title":"Fixtures Consumed","type":"array"},"fixtures_produced":{"items":{"minLength":1,"pattern":"^(?!/)(?![A-Za-z]:)(?!.*\\\\)(?!.*(?:^|/)(?:\\.{1,2})(?:/|$))(?!.*//).+$","type":"string"},"title":"Fixtures Produced","type":"array"},"forbidden_scope_touched":{"title":"Forbidden Scope Touched","type":"boolean"},"head_commit":{"pattern":"^[0-9a-f]{40,64}$","title":"Head Commit","type":"string"},"integration_notes":{"items":{"maxLength":65536,"minLength":1,"type":"string"},"title":"Integration Notes","type":"array"},"known_limitations":{"items":{"maxLength":65536,"minLength":1,"type":"string"},"title":"Known Limitations","type":"array"},"risks":{"items":{"maxLength":65536,"minLength":1,"type":"string"},"title":"Risks","type":"array"},"scope_completed":{"items":{"maxLength":65536,"minLength":1,"type":"string"},"title":"Scope Completed","type":"array"},"spec_id":{"enum":["S00","S01","S02","S03","S04","S05","S06","S07","S08"],"title":"Spec Id","type":"string"},"tests":{"items":{"$ref":"#/$defs/HandoffTestResult"},"title":"Tests","type":"array"},"title":{"maxLength":65536,"minLength":1,"title":"Title","type":"string"}},"required":["spec_id","title","executor","contract_revision","contract_base_commit","branch","head_commit","scope_completed","changed_files","fixtures_consumed","fixtures_produced","tests","dependency_requests","contract_change_requests","known_limitations","risks","integration_notes","forbidden_scope_touched"],"title":"HandoffRecord","type":"object"}
