{"branch":"codex/v1-s00-contract-freeze","changed_files":["src/problem_locator/contracts/models.py"],"contract_base_commit":"1111111111111111111111111111111111111111","contract_change_requests":[],"contract_revision":"v1-contract-r1","dependency_requests":[],"executor":{"model":"gpt-5.6-sol","reasoning_effort":"ultra"},"fixtures_consumed":[],"fixtures_produced":["tests/fixtures/contracts/fixture-manifest.json"],"forbidden_scope_touched":false,"head_commit":"2222222222222222222222222222222222222222","integration_notes":[],"known_limitations":[],"risks":[],"scope_completed":["public contract package"],"spec_id":"S00","tests":[{"command":"python -m pytest tests/contracts -q","status":"passed","summary":"contract tests passed"}],"title":"Contract Freeze and Public Test Specification"}
